{"$schema":"https://json-schema.org/draft/2020-12/schema","$id":"external_validation.session2_public_seed.v1","type":"object","additionalProperties":false,"required":["schema_id","schema_version","seed","generation_command","generated_at"],"properties":{"schema_id":{"const":"external_validation.session2_public_seed.v1"},"schema_version":{"const":"1"},"seed":{"pattern":"^[0-9a-f]{64}$"},"generation_command":{"type":"string","minLength":1},"generated_at":{"type":"string","format":"date-time"}}}
