{"schema_id":"external_validation.session2_public_seed.v1","schema_version":"1","seed":"7927e7ae3745cff2114d091e76004c86d4df555051a19778b7ccca991d2eaedd","generation_command":"python -c \"import json,secrets; from datetime import datetime,timezone; print(json.dumps({'seed':secrets.token_hex(32),'timestamp':datetime.now(timezone.utc).isoformat().replace('+00:00','Z')}))\"","generated_at":"2026-07-28T14:20:47.956074Z"}
